dayNumber,day,session,lengthMin,startTimeEDT,endTimeEDT,type,title,presenters,abstract,YouTubeLink,materialsLink
3,"Fri, Oct 15",t1_fri,20,10:00 AM,10:20 AM,Short Talks,Rating Data Management Plans: Lessons learned from the Qualitative DMP Competition,"Sebastian Karcher (Qualitative Data Repository at Syracuse University), Maria Praetzellis (California Digital Library), Matt Chandler (Princeton University)","The inaugural Qualitative Data Management Plan (DMP) Competition kicked off in December 2020 and was sponsored jointly by The Qualitative Data Repository, Princeton Research Data Service, and the DMPTool. As qualitative researchers writing such plans frequently ask for examples of excellent DMPs for qualitative research, we hoped that this competition would assemble a trove of exemplar DMPs that we could share with the research community. Three expert judges reviewed each entry.  They assessed DMPs on a an 18-item rubric based on the DART Project as well as guidance from the DMPTool. Based on these reviews, the organizers selected 11 prize-winning DMPs and shared them with the research data management community to use as examples. This short talk will review insights garnered from the competition and discuss potential additional uses for the review rubric designed for the project. We will also present a brief overview of the winning DMPs and their characteristics and examine the use of exemplary plans in data management support and training.
",,
3,"Fri, Oct 15",t1_fri,20,10:20 AM,10:40 AM,Short Talks,Forging Connections at the University of North Texas to Comply with Funder-Mandated Public Access to Research Data,Whitney Johnson-Freeman (University of North Texas),"Openness in research data is widely supported, but it can be difficult to forge new connections across campus. At the University of North Texas (UNT), we have established a collaboration between the UNT Libraries and the Division of Research and Innovation to proactively document and provide stable, long-term access to information about federally-funded grant projects received at UNT, but more importantly to act as a centralized location for accessing research and grant artifacts including documentation and datasets created during the award period.  This collaboration made use of existing infrastructure like the UNT Digital Library to host data management plans for each of the grant projects, provide a stable, unique, and publicly available identifier and URL for the project, and act as a platform for linking and connecting the grant project with its data and publishing output. This presentation will highlight successes, challenges, and areas still in need of improvement in this new process.",,
3,"Fri, Oct 15",t1_fri,20,10:40 AM,11:00 AM,Short Talks,Beginning at the end with data management curricula,"Eric Olson (Center for Open Science), Nici Pfeiffer (Center for Open Science), April Clyburne-Sherin (Reproducibility for Everyone)","Due to increasing demand for data management training services from diverse research disciplines, Center for Open Science staff utilized “beginning at the end” exercises to identify the primary skills that researchers need to learn in order to be compliant with trending funder and institutional data policies and how they are most likely to apply them.  We developed completely new modules designed to organically connect these policies to the rigorous research practices needed to comply with them, and applications of those practices within our research lifecycle support tool, the OSF.

This talk will describe our curriculum design process, our findings in relation to prioritized skills, and the measures we took to keep audience needs as the primary reason and focus of each module.  We will also share our efforts to enable advocates and experts to utilize the modules within their own communities through careful pedagogy considerations, documentation, and resource availability.
",,
3,"Fri, Oct 15",b1_fri,15,11:00 AM,11:15 AM,Break,,,,,
3,"Fri, Oct 15",t2_fri,20,11:15 AM,11:35 AM,Short Talks,The Accidental Digital Humanities Librarian: Strategies and Tools for supporting Textual Data Analysis,David Sye (Murray State University),"Text and Data Mining (TDM) has become a popular avenue for scholarly activity, although not all libraries have a dedicated data/digital humanities librarian to support such research. Murray State University does not have a data/digital humanities librarian, so as the subject librarian for history and the social sciences, I found it necessary to familiarize myself with text analytics to support digital humanities research. Two resources I use to support and introduce faculty to TDM are Voyant Tools and Constellate. Voyant Tools is an online open-source software that contains various tools for data visualization of a text, or collection of texts. Murray State University currently participates in the beta program for Constellate, a text and data analytics platform from Ithaka, the parent company of JSTOR. In this short presentation, I will explain the various uses of these platforms and share resources on how to introduce these tools to faculty and students.",,
3,"Fri, Oct 15",t2_fri,20,11:35 AM,11:55 AM,Short Talks,Data Stewardship Competency Centers Implementation Network,Melissa Cragin (University of California San Diego),"With the aim of facilitating “international convergence for interoperability and reuse of research outputs in open science environments,” the GO FAIR Data Stewardship Competence Centers (DSCC) Implementation Network is growing initiative. Acceleration toward an Open Science landscape necessitates a significant expansion of the pool of experts currently serving in Research Data Stewardship (RDS) roles. GO FAIR Implementation Networks work as consortia to improve uptake and implementation of the FAIR Principles; they function as coordination and dissemination points for participants to share or leverage resources, and learn about new institutional approaches, emergent technologies, and training materials. This short talk will provide an update on global DSCC initiatives, opportunities for engagement, and implications for future Public Access requirements.",,
3,"Fri, Oct 15",t2_fri,20,11:55 AM,12:15 PM,Short Talks,Closing remarks,,,,
3,"Fri, Oct 15",b2_fri,45,12:15 PM,1:00 PM,Break,,,,,
3,"Fri, Oct 15",w3_fri,90,1:00 PM,2:30 PM,Workshops,ArcGIS StoryMaps: Everybody Has A Story To Tell,"Samah Alshrief (Seton Hall University), Sharon Ince (Seton Hall University) Lisa DeLuca (Seton Hall University), Chelsea. H. Barrett (Seton Hall University)","ArcGIS is one of the most popular story-telling tools which has been used to integrate interactive multimedia, maps, and text. In this workshop, we will train the audience on how to use ArcGIS StoryMaps step-by-step to create their own StoryMap. In our presentation, we will use an example created and dispensed by our Data Services Team for marketing and outreach initiatives on the Seton Hall University campus. Participants will be able to create customized express maps for buildings and roads in addition to integrating videos and/or posts from social media. ",,
3,"Fri, Oct 15",w3_fri,90,1:00 PM,2:30 PM,Workshops,Python coding and data visualization with the Crossref API,"Erin Cheever (LAC Group), Jacob Berg (LAC Group)","Have you ever wondered how you can get started with APIs for data analysis, but weren’t sure where to begin? This workshop will show you how to use free and open source tools to access data from the Crossref publication data API. We will review the features of Crossref as a data source, walk through the two Python libraries you’ll need to access the API (Pandas and Requests), and talk about different freely available visualization software including Microsoft Power BI and Google Data Studio. We will code together in real time using Google Colab Jupyter Notebooks and leave you with example code that you can begin modifying to pull data relevant to your institution.",,