dayNumber,day,session,lengthMin,startTimeEDT,endTimeEDT,type,title,presenters,abstract,YouTubeLink,materialsLink
1,"Wed, Oct 13",t1_wed,20,10:00 AM,10:20 AM,Short Talks,Welcome and symposium logistics,,,,
1,"Wed, Oct 13",t1_wed,20,10:20 AM,10:40 AM,Short Talks,Practical Reproducibility Instruction: Teaching Reproducibility with Technical and Non-Technical Tools,"Jennifer Huck (University of Virginia), Sherry Lake (University of Virginia), Erich Purpur (University of Virginia)","UVA Library Research Data Services (RDS) launched a new workshop series called “Reproducible Research for Early Graduate Students.” The four workshops in the series focused on technical and non-technical tools for reproducible research. The overall concept was to enable researchers to improve data use and re-use for collaborators and themselves, use available technical tools to create reproducible workflows, and more easily communicate and disseminate findings and data. Technical sessions covered version control and R Studio tools; non-technical sessions covered file and metadata organization and data sharing. We launched it as a standalone mini-series within our ongoing data workshop series.  We leveraged a relatively varied skillset among library staff to present these sessions. Data, code, and more information is openly available. While graduate students were the most common attendee type, we had a significant number of post-docs and research staff attend our sessions. Feedback collected via follow-up surveys was generally positive prompting us to offer the series again this Fall. We believe our efforts are reproducible at other institutions in a similar way or at a smaller/larger scale and will discuss how.",,
1,"Wed, Oct 13",t1_wed,20,10:40 AM,11:00 AM,Short Talks,Introducing Scientific Data Pipelines to Novice Students,Ali Krzton (Auburn University),"As part of a new course on weather and climate aiming to facilitate science literacy in non-science majors, the Research Data Management Librarian was invited to design and teach a lab where students worked with data. First, students were introduced to the air quality index (AQI) and the raw pollutant concentration data behind the calculated value. Next, they were given an overview of measurement classes and simple data typing in Excel. With guidance from the instructor, students identified and corrected errors in a mock AQI data sheet to make it machine-readable. Conducting the lab revealed that in sessions for data novices, instructors must balance showing students how to perform certain functions step-by-step with fostering conceptual understanding of what they are doing. It is also helpful to connect the class activities with related tasks in students’ future coursework or employment.",,
1,"Wed, Oct 13",b1_wed,15,11:00 AM,11:15 AM,Break,,,,,
1,"Wed, Oct 13",t2_wed,20,11:15 AM,11:35 AM,Short Talks,Examining Research Data Management Awareness & Practices of STEM Research Faculty and Graduate Students across Penn State University Campuses,"Andrea Pritt (Penn State University), Briana Wham (Penn State University)","A major task for data stewards offering research data services is providing support and training for research data management (RDM) to diverse researcher communities. Here, we present the findings from an investigation of RDM awareness and practices of STEM researchers at the Pennsylvania State University (PSU). As PSU is a multi-disciplinary institution composed of 20 campuses varying in size and research focus, we were able to explore differences across STEM disciplines, career stages (graduate student vs. faculty), and campus sizes through both an online survey and focus groups. Overall, the insights gained from this project offer generalizable knowledge regarding how factors such as discipline and campus size can influence awareness and adoption of RDM practices. Thus, this presentation will be of broad interest to attendees interested in tailoring research data services to unique researcher needs and campus environments.",,
1,"Wed, Oct 13",t2_wed,20,11:35 AM,11:55 AM,Short Talks,Data Analytics and Visualization Services in the Libraries,"Paulina Krys (Penn State University), Xuying Cindy Xin (Penn State University)","As part of a top-tier research library, the Penn State University Libraries have been supporting students, faculty and staff from various colleges at the University by providing services throughout the research lifecycle: from finding data, project planning and management, to data analysis and visualization, data sharing and preservation. During the past few years, we have been working with patrons from various backgrounds to help them better understand the possibilities for exploratory data analysis using data visualization tools. Driven by high and constantly growing demand for data analytics and visualization techniques from the research community, we continue to support these service needs via workshops, consultations, and a Digital Lab with remote access to special software tools, including data visualization software such as Tableau and Power BI. In this talk, we will review the data analytics and visualization services we provide for the university community, discuss services for big data analytics on cloud and give an overview of the partnerships that make our work successful. We will summarize what we have learned so far and discuss some of the plans we are making to meet the current needs of the community.",,
1,"Wed, Oct 13",t2_wed,20,11:55 AM,12:15 PM,Short Talks,"It’s Big, It’s Messy, and It’s Complicated: An Assessment of “Big Data” Research Support Needs","Mandy Swygart-Hobaugh (Georgia State University), Jeremy Walker (Georgia State University)","A team of Georgia State University (GSU) University Librarians took part in a multi-institutional research study coordinated by the Ithaka S+R research and consulting organization to examine the research support needs of GSU faculty doing “big data” research. The GSU team’s primary aims for conducting the study were as follows: (1) to identify the key research support needs and associated challenges faced by GSU “big data” researchers, and (2) to offer possible paths toward improved support of GSU researchers in this area that capitalize on the Library’s strengths and have feasible return on investment. In this presentation, we will give an overview of the GSU-specific insights gleaned from our participation in this study and where we think they will take us in terms of “big data” research support, and discuss what other institutions might learn from our insights and experience of participating in an Ithaka study.",,
1,"Wed, Oct 13",b2_wed,45,12:15 PM,1:00 PM,Break,,,,,
1,"Wed, Oct 13",w3_wed,90,1:00 PM,2:30 PM,Workshops,Tips for Effective Data Visualization,Eric Monson (Duke University),"Visualization is a powerful way to reveal patterns in data, attract attention, and get your message across to an audience quickly and clearly. But, there are many steps in that journey from exploration to information to influence, and many choices to make when putting it all together to tell your story. I will cover some basic guidelines for effective visualization, point out a few common pitfalls to avoid, and run through a critique and iterations of an existing visualization to help you start seeing better choices beyond the program defaults.",,
1,"Wed, Oct 13",w3_wed,90,1:00 PM,2:30 PM,Workshops,Data Management Planning with DMPTool,"Jo Klein (University of North Carolina Greensboro), Nina Exner (Virginia Commonwealth University), Lindsay Gypin (University of North Carolina Greensboro)","Is your library starting to offer data management plan services? Does thinking about helping a researcher with their data management plan give you nightmares? Helping researchers write a data management plan (DMP) is an essential service that data librarians may be asked to provide. DMPs are required for many funded research studies, but they are often not intuitive. New data librarians may want to know: what information goes into a plan, what do the section headers mean, and how do plans differ across disciplines? DMPTool (https://dmptool.org) is here to help! DMPTool is one of the most commonly used, freely available tools for writing a plan, with templates and resources to help guide researchers through the planning process. In this workshop, three data librarians will demonstrate how to use DMPTool and answer the questions that keep you up at night, through a simple exercise to explore what information might go in a DMP and how DMPTool’s built-in templates can help a data librarian step through data management interviews with researchers. At the end of the workshop, participants will be able to (1) access DMPTool; (2) select a DMP template based on a funding agency; and (3) provide an example of which information might go in the most common sections of a plan.",,
2,"Thu, Oct 14",t1_thurs,20,10:00 AM,10:20 AM,Short Talks,Public Interest Data Literacy (PIDLit): Empowering First-Year Students with Data Skills,Ashley Rockwell (Georgia State University),"How can we empower students with data literacy skills? In this presentation we will give an overview of our new Public Interest Data Literacy (PIDLit) initiative. The PIDLit initiative, led by the Georgia State University Library, together with multiple campus partners is focused on expanding programs promoting data literacy for the public good and equipping first-year students and underrepresented groups with data skills, thereby building a more diverse pipeline of students pursuing data careers. Attendees will learn about core strategies for empowering students with data literacy through adoptable lessons for introductory courses, data literacy workshops, and a data-focused speaker series. We will also invite you to utilize and contribute to our new publicly available data lessons resource hub.",,
2,"Thu, Oct 14",t1_thurs,20,10:20 AM,10:40 AM,Short Talks,Staying Up-to-Data: Collaborating to Foster Data and Visualization Skills in Undergraduate Engineering Students,"Natalia Lopez (North Carolina State University), Claire Cahoon (North Carolina State University), Michelle Leonard (North Carolina State University)","In fall 2020, NC State University engineering librarians launched a listening tour with faculty members across all departments in the College of Engineering to determine how librarians could best support undergraduate engineering researchers. Faculty members expressed interest in partnering with the Libraries to support student development of critical data and visualization skills that are core to engineering communication. The engineering librarians collaborated with the Data and Visualization Services department to develop asynchronous data and visualization learning modules to help undergraduate engineering researchers develop skills for locating data, distinguishing between common file types, downloading datasets, using data dictionaries, analyzing data using Google Sheets and basic-level Python, developing data visualization design skills, and selecting appropriate chart types for visualizations. Topics in this presentation will include the process of designing and implementing the modules, building collaborations between departments, example lessons and outputs, researcher assessment and feedback from the Spring 2021 pilot, and future plans.",,
2,"Thu, Oct 14",t1_thurs,20,10:40 AM,11:00 AM,Short Talks,Data support for undergraduate research:  Results of an Ithaka study at UNC-Chapel Hill,"Michele Hayslett (University of North Carolina at Chapel Hill), Angela Bardeen (University of North Carolina at Chapel Hill)","Many campuses are moving rapidly toward integrating data literacy and data science in the undergraduate curriculum. Ithaka S+R, a research organization assisting academic and cultural communities, recognized this trend across universities in the U.S. and coordinated a national study to investigate the support needed by social sciences faculty teaching with data. The UNC at Chapel Hill project team interviewed thirteen instructors across the social sciences to identify ways the Libraries could improve support for teaching undergraduates with data in these fields. Other libraries may learn from UNC’s results with suggestions that are often both sustainable and non-resource intensive, from extending existing workshop offerings to providing additional asynchronous resource guides. And while this project focused on the social sciences, the results are broadly applicable across all disciplines.",,
2,"Thu, Oct 14",b1_thurs,15,11:00 AM,11:15 AM,Break,,,,,
2,"Thu, Oct 14",t2_thurs,20,11:15 AM,11:35 AM,Short Talks,Data Consultations: This Is How We Do It,"Samah Alshrief (Seton Hall University), Sharon Ince (Seton Hall University), Lisa DeLuca (Seton Hall University), Chelsea H. Barrett (Seton Hall University)","A Data Services team at a medium-sized R2 private university is evaluating the efficacy of the data consultation workflow which provides support for the Seton Hall University community. In this presentation, we intend to take the audience step-by-step through the organization and implementation of data research consultations for faculty and students. We will demonstrate how patrons go through the process of requesting an appointment, gaining access to our software and then discuss collecting data to analyze for department improvement. Participants may find it beneficial to know the tools and software used to manage and assess the workflow of research data consultations, the components of the appointment form created to assign tasks to the appropriate team member, the challenges we have faced and where we have succeeded.",,
2,"Thu, Oct 14",t2_thurs,20,11:35 AM,11:55 AM,Short Talks,The Universe(ity) Does Revolve Around Us: The Library as a Central Hub for Research Data Management Services,"Claire Payne (Stony Brook University), Jessica Koos (Stony Brook University)","Over the past several years, Stony Brook University campus stakeholders from areas including the University Libraries, Information Technology, the Office of the Vice President for Research, Biomedical Informatics, and Clinical Research have come together to coordinate SBU’s research data efforts. Even while the University Libraries does not currently have a full-time data librarian, the library has emerged as a campus leader in these collaborative research data efforts and initiatives. 

This presentation will detail how a group of librarians has been able to creatively work together to continuously grow the suite of research data-related services we offer. These collective efforts--including offering workshops across campus and creating a comprehensive research guide highlighting university-wide resources--have effectively positioned the Libraries as a central hub of information for the entire university on research data management. Our work continues as we play a key role in selecting and implementing a new data repository for the university community.   ",,
2,"Thu, Oct 14",t2_thurs,20,11:55 AM,12:15 PM,Short Talks,What does the reference interview accomplish and how does that translate to data? A model for the ‘data interview’ in libraries,"Brianne Dosch (University of Tennessee Knoxville), Monica Ihli (University of Tennessee Knoxville)","The “data interview” is not a new concept in librarianship (Carlson, 2011), but it is an evolving concept as research methods mature and expand. Due to this growing and changing nature of research data needs, how can librarians use the data interview to quickly and effectively identify and fill that information need? This presentation will explore a model of the data interview that can assist librarians in identifying the scale of a data request, how the scale in turn informs methodology and access, and how to manage the expectations and grow the skills of researchers along the way. Takeaways include what librarians/libraries should know and understand about data standards, data tools, and data access in order to conduct a successful data interview, and how that understanding can raise the level and quality of research across campuses and disciplines.

Source: Carlson, J. (2011). Demystifying the Data Interview: Developing a Foundation for Reference Librarians to Talk with Researchers about their Data. Reference Services Review. https://docs.lib.purdue.edu/lib_research/153",,
2,"Thu, Oct 14",b2_thurs,45,12:15 PM,1:00 PM,Break,,,,,
2,"Thu, Oct 14",p3_thurs,90,1:00 PM,2:30 PM,Posters,Escape Data Horror: Creating Innovative Ways to Teach Research Data Management,"Lachelle Smith (Augusta University), Jennifer Putnam Davis (Augusta University)","Two faculty librarians at a health sciences library implemented an innovative approach for incorporating virtual reality (VR) experiences in health sciences education. The project involved using VR to develop an escape room that introduces players to research data management principles and best practices. By playing this game, students will be able to understand the best practices for organizing, describing, and storing data. Game elements consist of puzzles that students complete in order to accomplish the objectives of learning the principles and best practices of ethically managing research data. A pilot program conducted with physical therapy doctorate students showed positive learning experiences. This poster will explain the elements of the game, summarize data from student feedback, and provide implications for future use of the project.",,
2,"Thu, Oct 14",p3_thurs,90,1:00 PM,2:30 PM,Posters,ETData: A look at data sharing for electronic theses and dissertations,Andrew Mckenna-Foster (Figshare),"Research data management and sharing are becoming standard practice for academic researchers, but what about for graduate students? While these skills may be taught as a skill in many graduate programs, their application in electronic theses or dissertations (ETDs) is patchy. There are many examples of graduate students sharing data through various repositories, but the adherence to the FAIR Principles (https://go-fair.org) varies widely. Additionally, other outputs related to an ETD can be valuable additions to the CV early in one’s career, but are often difficult to locate and cite. This poster examines the trends in how data and other outputs related to ETDs are shared in institutional repositories using the Figshare platform and on figshare.com. It looks at ETD metadata and the use of the Collections feature in Figshare and offers suggestions for best practices to increase the FAIRness of the outputs.",,
2,"Thu, Oct 14",p3_thurs,90,1:00 PM,2:30 PM,Posters,"Analyzing University of Virginia Health Publications Using Open Data, Python, and Streamlit","Lucy Carr Jones (University of Virginia), Anson Parker (University of Virginia)","As part of a larger project to understand the publishing choices of UVA Health authors and support open access publishing, a team from the Claude Moore Health Sciences Library analyzed an open data set from Europe PMC, which includes metadata from PubMed records. After using the Europe PMC REST API to search for articles from 2017 to 2020 with UVA listed as the affiliation of one or more authors, the team parsed the JSON metadata in Python and used Streamlit to create an online dashboard from our public GitHub repository. Although the dashboard is a work in progress, the project has provided some valuable lessons about the utility of open citation data sources and low-code tools like Streamlit.",,
2,"Thu, Oct 14",p3_thurs,90,1:00 PM,2:30 PM,Posters,Crawfishing for data: Using iNaturalist for data literacy instruction,"Jo Klein (University of North Carolina at Greensboro), Megan Carlton (University of North Carolina at Greensboro)","iNaturalist is a platform where citizen scientists, biologists, and naturalists share observations of organisms like the humble crawfish. Through crowd-sourced data collection, iNaturalist users directly contribute to an open, research-grade biodiversity dataset and strengthen their data literacy skills. Librarians can use both the iNaturalist data collection workflow and the resulting data in data literacy instruction for a wide range of audiences and skill levels. In this poster presentation, we’ll map data literacy competencies, such as Carlson, Miller, Fosmire, and Nelson’s Core Competencies for Data Information Literacy and Mandinach and Gummer's list of data literacy skills, to various instructional activities using the iNaturalist platform, with examples of how these competencies and activities can be incorporated into a broader information literacy curriculum.",,
2,"Thu, Oct 14",p3_thurs,90,1:00 PM,2:30 PM,Posters,dLOC as Data: Lessons Learned From Making Digital Collections Data Available at Scale,"Molly Castro (Florida International University), Jill Krefft (Florida International University), Rebecca Bakker (Florida International University), Perry Collins (University of Florida), Laura Perry (University of Florida)","dLOC as Data, an initiative of the Digital Library of the Caribbean under the direction of Florida International University and the University of Florida, has recently completed a grant under the “Collections as Data: Part to Whole” program. By making newspaper titles available for bulk data download—and therefore more easily accessible for computational analysis—the project has potential to broaden engagement with Caribbean newspapers, much as projects such as Chronicling America and Europeana have done for a wide range of newspaper collections. 

This poster will focus on lessons learned in developing the data collection and a complementary “thematic toolkit” that delves into more granular datasets focused on newspaper coverage of hurricanes, generated through manual and computational methods. The poster will provide insight into OCR, data migration workflows, analysis, and what the project team learned in reaching out to a broad audience of dLOC partners, librarians, and digital humanities scholars.",,
2,"Thu, Oct 14",p3_thurs,90,1:00 PM,2:30 PM,Posters,Data sharing for Master Theses:  Survey and Recommendations.,Sarah Holsapple (University of North Carolina at Chapel Hill),"As new practices become established procedures, we must amend policies and guidelines to expand to fit these new norms. Data sharing is now becoming an expectation in scientific research. This paper will survey the landscape of data sharing policy from funders, publishers, and universities and will take from those policies to suggest changes to the UNC SILS master’s paper/project policy to include a data sharing component, namely, a data management plan and a data availability statement. In order to assist students following the new policy and sharing data if desired, this project will create a libguide outlining best practices for data sharing and a step by step process to share data at UNC SILS.",,
2,"Thu, Oct 14",p3_thurs,90,1:00 PM,2:30 PM,Posters,Data Literacy as Critical Information Literacy: Teaching Both via the Frame “Information Creation as a Process”,Julia Bauder (Grinnell College),"Data literacy involves two sets of skills: (1) a basic technical literacy that allows the student to understand the meaning that a given data representation is attempting to convey and (2) a critical literacy that allows the student to understand how power, authority, and conscious human choices play a large part in determining what the data “says.” The frame “Information Creation as a Process” from the ACRL Framework for Information Literacy for Higher Education provides a structure for teaching both aspects of data literacy at once, as students are guided through the creation of simple data visualizations or data analyses and encouraged to explore how making different choices can lead to very different results, even when all of the choices made are reasonable and valid. This talk will highlight some examples from the literature of this type of data literacy instruction.",,
2,"Thu, Oct 14",p3_thurs,90,1:00 PM,2:30 PM,Posters,Visualizing Global Tweet Activity for NIH Covid-19 Preprints,Levi Dolan (National Library of Medicine),"As a result of the Covid-19 pandemic, the focus on preprint articles as a means of rapid research dissemination has sharply intensified.  Produced as part of a larger project examining public comments on preprint articles, this poster breaks down an automated method which was used to gather geographic information via an Altmetric API for the 200k+ Tweets about 1,000 of the first articles in the NIH Preprint Pilot.  The workflow in gathering the information for a final visualization is explained, with the results visualized as a global map overlaid with a scatterplot.",,
2,"Thu, Oct 14",p3_thurs,90,1:00 PM,2:30 PM,Posters,Propel: UVa Library Working with Career Services,Nancy Kechner (University of Virginia),"UVa Library's Research Data Services (RDS) worked with Career Services on a virtual Summer Internship for undergraduate students to teach Data Literacy and Data Visualization using Tableau. Students were enrolled for a five week program where RDS staff taught Tableau to visualize public health data. Students were also given sessions on career service skills to enhance their career portfolios. Student groups then presented their data stories to the other groups, and a panel of experts.",,
